{
  "Name": "Latin-1 encoded",
  "BIDSVersion": "1.0.2",
  "License": "CC0",
  "Authors": ["B�a"],
  "Acknowledgements": "Conseil r�gional Auvergne ",
  "HowToAcknowledge": "shoutout on insta plz",
  "Funding": ["Contrat AIB 23000400", "AIC AromaSalt"],
  "ReferencesAndLinks": ["e0123456. doi:99.9999/journal.pone.0123456"],
  "DatasetDOI": "doidoidoidoi"
}
